{
  "$schema": "../../Schemas/building-archetype.schema.json",
  "schema": "moyva.building-archetype",
  "version": 1,
  "id": "productiontemplate",
  "model": "building-archetype",
  "displayName": "Production Building Template",
  "role": "Production",
  "category": "Industrial",
  "footprint": {
    "size": {
      "x": 1,
      "y": 1
    },
    "anchor": "Center",
    "customAnchor": {
      "x": 0,
      "y": 0
    },
    "blocksMovement": true,
    "blocksConstruction": true,
    "requiresFlatGround": true,
    "occupiedCells": [],
    "entranceCells": [],
    "roadConnectionCells": []
  },
  "placement": {
    "canPlaceInFog": false,
    "requiresSettlementInfluence": true,
    "createsSettlementInfluence": false,
    "blockIfSettlementCenterInRange": false,
    "influenceRadius": 0,
    "minDistanceFromSettlementCenters": 0,
    "requiredTerrainIds": [],
    "requiredNeighborOffsets": [],
    "requiresWaterNearby": false,
    "requiresForestNearby": false,
    "requiresMountainNearby": false,
    "requiresRoadNearby": false,
    "nearbyTileRequirements": []
  },
  "construction": {
    "cost": [],
    "buildTurns": 2,
    "requiresBuilder": true,
    "workRequired": 0
  },
  "runtimeStats": {
    "maxHp": 100,
    "armor": 0,
    "flags": "BlocksPath, Selectable, Damageable",
    "runtimeTags": []
  },
  "modules": [
    {
      "$type": "workforce",
      "workersRequired": 1,
      "priority": 0,
      "workerTypeId": "",
      "isEnabled": true,
      "singletonScope": "PerBuilding"
    },
    {
      "$type": "production",
      "resourceId": "",
      "workersRequired": 0,
      "priority": 0,
      "recipes": [],
      "isEnabled": true,
      "singletonScope": "PerBuilding"
    },
    {
      "$type": "fog-reveal",
      "revealRadius": 3,
      "shape": "PixelCircle",
      "revealOnBuilt": true,
      "revealWhileActive": true,
      "onlyAfterConstructionComplete": true,
      "isEnabled": true,
      "singletonScope": "PerBuilding"
    }
  ],
  "migration": {
    "sourceAssetGuid": "3b5cdd4983ef4a49b2f9dfbcde93c768",
    "sourceAssetPath": "Assets/Moyva/Data/ScriptableObjects/Construction/Templates/ProductionTemplate.asset",
    "sourceHash": "3016d1864f406ddd288bdebf57839556c13442613462f89c4e0c83cc3c1c9bd8"
  }
}
